{
  "message_type": "tool.execution_request",
  "protocol_version": "0.1.1",
  "request_id": "req-0001",
  "task_id": "task-0001",
  "span_id": "span-0001",
  "device_id": "device-0001",
  "tool": "phone.current_app",
  "parameters": {},
  "state_precondition": null,
  "verification": null,
  "idempotency_key": "idem-0001",
  "attempt": 1,
  "requested_at": "2026-08-30T10:00:00Z",
  "deadline": "2026-08-30T10:00:30Z"
}
